{
  "schema_version": "2.0",
  "source_id": "go1-001",
  "node_id": "pi7",
  "zone_id": "zoneA",
  "camera_id": "go1-001_front",
  "sequence_id": 1532,
  "session_id": "a1b2c3d4e5f6",
  "timestamp": "2026-10-12T14:10:31.049+09:00",
  "encoding": "jpeg",
  "width": 464,
  "height": 400,
  "sha1": "cb83195c76df309d"
}
